{
  "id": "LO-LH-PHIB-003-03",
  "competency": "COMP-IPM-ADV-001",
  "statement": "Distinguish thrips and fungus-gnat life stages, signs, injury patterns, sampling locations, and common look-alikes using evidence appropriate to greenhouse crop scouting.",
  "bloomLevel": "analyze",
  "status": "draft",
  "version": "0.1.0"
}
