{
  "id": "LO-FLOWER-001",
  "competency": "COMP-FLOWER-001",
  "statement": "Given flowering-stage observations and maturity indicators, distinguish normal development from readiness signals and identify the evidence needed before harvest decisions.",
  "bloomLevel": "analyze",
  "status": "draft",
  "version": "1.0.0"
}
