{
  "id": "LO-LH-TECH1-003-04",
  "competency": "COMP-CULT-EQUIPMENT-CARE-001",
  "statement": "Perform permitted operator-level sensor and environmental-equipment readiness checks and escalate faults, alarms or conditions that require unauthorized repair or control redesign.",
  "bloomLevel": "apply",
  "status": "draft",
  "version": "1.0.0"
}
