{
  "id": "LO-LH-PHQ-003-03",
  "competency": "COMP-POSTHARVEST-QA-001",
  "statement": "Evaluate package suitability using barrier, headspace, closure, product-compatibility and handling evidence rather than marketing claims.",
  "bloomLevel": "evaluate",
  "status": "draft",
  "version": "0.1.0"
}
