{
  "id": "LO-LH-EIFS-007-04",
  "competency": "COMP-IRRIGATION-ADV-001",
  "statement": "Evaluate crop-steering adjustments from measured root-zone, environment and crop response while preserving study/system boundaries and avoiding universal recipes.",
  "bloomLevel": "evaluate",
  "status": "draft",
  "version": "0.1.0"
}
