{
  "id":"LO-POSTHARVEST-STORAGE-003",
  "competency":"COMP-POSTHARVEST-001",
  "statement":"Evaluate curing, packaging, and storage conditions for moisture equilibration, contamination risk, oxygen and light exposure, and chemical stability.",
  "bloomLevel":"analyze",
  "status":"draft",
  "version":"1.0.0"
}
