{
  "id": "LO-LH-TECH1-002-03",
  "competency": "COMP-PLANT-BIO-001",
  "statement": "Differentiate direct observation, spatial or population pattern, contextual evidence and unsupported causal diagnosis during routine crop inspection.",
  "bloomLevel": "analyze",
  "status": "draft",
  "version": "1.0.0"
}
