{
  "id": "LO-LH-EIFS-005-04",
  "competency": "COMP-WATER-QUALITY-ADV-001",
  "statement": "Execute and verify an approved solution-preparation workflow using material identity, recipe version, final volume, ordered additions, mixing and measured acceptance criteria without independently redesigning the formula.",
  "bloomLevel": "apply",
  "status": "draft",
  "version": "0.1.0"
}
