{
  "id": "LO-LH-TECH2-008-05",
  "competency": "COMP-IPM-ADV-001",
  "statement": "Integrate IPM trend evidence with propagation and canopy performance while protecting biosecurity, treatment-authority limits, cultivar or stage context and uncertainty.",
  "bloomLevel": "evaluate",
  "status": "draft",
  "version": "1.0.0"
}
