{
  "id": "LO-LH-EIFS-004-05",
  "competency": "COMP-PRO-QA-001",
  "statement": "Produce a maintenance/controls handoff that identifies device, time, command, observed response, affected process, verification already completed and safe authority boundary.",
  "bloomLevel": "create",
  "status": "draft",
  "version": "0.1.0"
}
