{
  "id": "LO-LH-EIFS-001-03",
  "competency": "COMP-LIGHT-001",
  "statement": "Relate PPFD, photoperiod and DLI measurements to crop-environment context without converting examples from other crops or studies into universal cannabis targets.",
  "bloomLevel": "analyze",
  "status": "draft",
  "version": "0.1.0"
}
