{
  "id": "LO-LH-PCS-004-02",
  "competency": "COMP-SPACE-BIOSEC-001",
  "statement": "Design a clean-to-dirty propagation workflow that controls tools, surfaces, people and plant movement without substituting generic advice for facility sanitation SOPs.",
  "bloomLevel": "create",
  "status": "draft",
  "version": "0.1.0"
}
